{
  "$schema": "https://json-schema.org/draft/2020-12/schema",
  "title": "multysm component manifest",
  "type": "object",
  "required": ["schema", "id", "name", "category", "symbol", "spice"],
  "additionalProperties": false,
  "properties": {
    "schema": { "const": 1 },
    "id": { "type": "string", "pattern": "^[a-z0-9]+(\\.[a-z0-9_]+)+$" },
    "name": { "type": "string", "minLength": 1 },
    "category": {
      "enum": ["Sources", "Basic", "Diodes", "Transistors", "Analog", "TTL", "CMOS",
               "Advanced Peripherals", "Misc Digital", "Mixed", "Indicators", "Power",
               "Misc", "RF", "Electromechanical"]
    },
    "tags": { "type": "array", "items": { "type": "string" } },
    "symbol": {
      "type": "object",
      "required": ["width", "height", "svg", "pins"],
      "additionalProperties": false,
      "properties": {
        "width": { "type": "integer", "minimum": 10 },
        "height": { "type": "integer", "minimum": 10 },
        "svg": { "type": "string", "minLength": 1 },
        "pins": {
          "type": "array",
          "minItems": 1,
          "items": {
            "type": "object",
            "required": ["id", "x", "y"],
            "additionalProperties": false,
            "properties": {
              "id": { "type": "string", "pattern": "^[A-Za-z0-9_+-]+$" },
              "name": { "type": "string" },
              "x": { "type": "integer" },
              "y": { "type": "integer" },
              "optional": { "type": "boolean" }
            }
          }
        }
      }
    },
    "params": {
      "type": "array",
      "items": {
        "type": "object",
        "required": ["key", "label", "default", "type"],
        "additionalProperties": false,
        "properties": {
          "key": { "type": "string", "pattern": "^[a-z][a-z0-9_]*$", "not": { "const": "ref" } },
          "label": { "type": "string" },
          "unit": { "type": "string" },
          "default": { "type": "string" },
          "type": { "enum": ["si", "text"] }
        }
      }
    },
    "spice": {
      "type": "object",
      "required": ["kind"],
      "properties": { "kind": { "enum": ["ground", "analog", "digital"] } },
      "if": { "properties": { "kind": { "const": "ground" } } },
      "then": { "additionalProperties": false, "properties": { "kind": true } },
      "else": {
        "required": ["refPrefix", "template"],
        "additionalProperties": false,
        "properties": {
          "kind": true,
          "refPrefix": { "type": "string", "pattern": "^[A-Z]+$" },
          "template": { "type": "string", "minLength": 1 },
          "models": { "type": "array", "items": { "type": "string" } },
          "subckt": { "type": "string" }
        }
      }
    },
    "live": { "type": ["object", "null"] },
    "controls": { "type": "array", "items": { "type": "object" } }
  }
}
