{
  "schema": 1, "id": "analog.opamp_ideal", "name": "Op-Amp (ideal)", "category": "Analog",
  "tags": ["opamp", "amplifier", "comparator", "U"],
  "symbol": { "width": 60, "height": 60, "svg": "../symbols/opamp.svg",
              "pins": [{ "id": "inn", "name": "-", "x": 0, "y": 20 },
                       { "id": "inp", "name": "+", "x": 0, "y": 40 },
                       { "id": "out", "name": "OUT", "x": 60, "y": 30 },
                       { "id": "vp", "name": "V+", "x": 30, "y": 0 },
                       { "id": "vn", "name": "V-", "x": 30, "y": 60 }] },
  "spice": { "kind": "analog", "refPrefix": "U", "subckt": "../models/opamp_ideal.lib",
             "template": "X{ref} {pin.inp} {pin.inn} {pin.out} {pin.vp} {pin.vn} OPAMP_IDEAL" }
}
