{
  "schema": 1, "id": "ttl.7404", "name": "7404 Hex Inverter", "category": "TTL",
  "tags": ["not", "inverter", "gate", "logic", "74"],
  "symbol": { "width": 80, "height": 160, "svg": "../symbols/dip14.svg",
    "pins": [
      { "id": "1",  "name": "1A",  "x": 0,  "y": 10,  "optional": true },
      { "id": "2",  "name": "1Y",  "x": 80, "y": 10,  "optional": true },
      { "id": "3",  "name": "2A",  "x": 0,  "y": 30,  "optional": true },
      { "id": "4",  "name": "2Y",  "x": 80, "y": 30,  "optional": true },
      { "id": "5",  "name": "3A",  "x": 0,  "y": 50,  "optional": true },
      { "id": "6",  "name": "3Y",  "x": 80, "y": 50,  "optional": true },
      { "id": "7",  "name": "GND", "x": 40, "y": 160 },
      { "id": "8",  "name": "4Y",  "x": 80, "y": 70,  "optional": true },
      { "id": "9",  "name": "4A",  "x": 0,  "y": 70,  "optional": true },
      { "id": "10", "name": "5Y",  "x": 80, "y": 90,  "optional": true },
      { "id": "11", "name": "5A",  "x": 0,  "y": 90,  "optional": true },
      { "id": "12", "name": "6Y",  "x": 80, "y": 110, "optional": true },
      { "id": "13", "name": "6A",  "x": 0,  "y": 110, "optional": true },
      { "id": "14", "name": "VCC", "x": 40, "y": 0 }
    ] },
  "spice": { "kind": "digital", "refPrefix": "U",
             "template": "X{ref} {pin.1} {pin.2} {pin.3} {pin.4} {pin.5} {pin.6} {pin.7} {pin.8} {pin.9} {pin.10} {pin.11} {pin.12} {pin.13} {pin.14} SN7404",
             "subckt": "../models/sn7404.lib" }
}
