{
  "schema": 1, "id": "basic.capacitor", "name": "Capacitor", "category": "Basic",
  "tags": ["passive", "C"],
  "symbol": { "width": 40, "height": 20, "svg": "../symbols/capacitor.svg",
              "pins": [{ "id": "1", "x": 0, "y": 10 }, { "id": "2", "x": 40, "y": 10 }] },
  "params": [{ "key": "capacitance", "label": "Capacitance", "unit": "F", "default": "1u", "type": "si" }],
  "spice": { "kind": "analog", "refPrefix": "C", "template": "{ref} {pin.1} {pin.2} {capacitance}" }
}
