{
  "schema": 1, "id": "diodes.1n4007", "name": "1N4007 Rectifier Diode", "category": "Diodes",
  "tags": ["rectifier", "power", "D"],
  "symbol": { "width": 40, "height": 20, "svg": "../symbols/diode.svg",
              "pins": [{ "id": "A", "name": "Anode", "x": 0, "y": 10 },
                       { "id": "K", "name": "Cathode", "x": 40, "y": 10 }] },
  "spice": { "kind": "analog", "refPrefix": "D", "template": "{ref} {pin.A} {pin.K} D1N4007",
             "models": ["* 1N4007: manufacturer SPICE parameters as published in common SPICE model collections",
                        ".model D1N4007 D(IS=7.02767n RS=0.0341512 N=1.80803 EG=1.05743 XTI=5 BV=1000 IBV=5e-08 CJO=1e-11 VJ=0.7 M=0.5 FC=0.5 TT=1e-07)"] }
}
